### ISSUE TITLE
Openwrt: проблема с переадресацией портов

### ISSUE THREAD

**Issue by suffermuffin** [Waujito/youtubeUnblock#79]
Привет! Я установил пакет на AP роутер, запустил:
```
root@OpenWrt:~# /etc/init.d/youtubeUnblock status
running
```
Переадресация была добавлена в nftables:

```
root@OpenWrt:~# nft list ruleset
table inet fw4 {
...
	chain mangle_forward {
		type filter hook forward priority mangle; policy accept;
		tcp dport 443 ct original packets < 20 counter packets 0 bytes 0 queue flags bypass to 537
	}
}

```
Однако, как видно, `mangle_forward` не ловит пакеты, скорости нет:

```
root@OpenWrt:~# curl ...
0     0    0     0    0     0      0      0 --:--:--  0:00:06 --:--:--     0
```
Также tcpdump говорит, что пакеты с портом 443 не поступают на мостовой интерфейс:

```
root@OpenWrt:~# tcpdump -i br-lan port 80 or port 443 or port 537 -c 5
tcpdump: verbose output suppressed, use -v[v]... for full protocol decode
listening on br-lan, link-type EN10MB (Ethernet), snapshot length 262144 bytes
17:34:25.647228 IP 192.168.0.2.80 > 192.168.0.104.41400: Flags [.], ack 3127470889, win 8010, options [nop,nop,TS val 2463209184 ecr 2872752555], length 0
17:34:25.647478 IP 192.168.0.104.41400 > 192.168.0.2.80: Flags [.], ack 1, win 501, options [nop,nop,TS val 2872753595 ecr 2463207102], length 0
17:34:26.687231 IP 192.168.0.2.80 > 192.168.0.104.41400: Flags [.], ack 1, win 8010, options [nop,nop,TS val 2463210224 ecr 2872753595], length 0
17:34:26.687540 IP 192.168.0.104.41400 > 192.168.0.2.80: Flags [.], ack 1, win 501, options [nop,nop,TS val 2872754635 ecr 2463207102], length 0
17:34:27.727231 IP 192.168.0.2.80 > 192.168.0.104.41400: Flags [.], ack 1, win 8010, options [nop,nop,TS val 2463211264 ecr 2872754635], length 0
5 packets captured
6 packets received by filter
0 packets dropped by kernel

```
Где ...104 ip ПК и ...2 ip wrt роутера-точки доступа.

В чём может быть проблема?
Немного подробнее о моём сетапе wrt тут: https://forum.openwrt.org/t/port-redirection-for-local-dpi-tunnel/208096

Буду признателен за помощь и прошу извинить за то что полный нуб в сетях.

**Comment by Waujito** [comment]
curl не будет работать на самом роутере, потому что правило работает на цепочке forward.

**Comment by suffermuffin** [comment]
Понятно, спасибо, но на машине тоже самое, я, естественно, проверял.

```
***-pc:~$ curl -o/dev/null
  0     0    0     0    0     0      0      0 --:--:--  0:00:08 --:--:--     0

```

**Comment by suffermuffin** [comment]
Может ли быть проблема с тем, что трафик сразу идёт на шлюз мимо openwrt роутера?

```
traceroute www.youtube.com
traceroute to www.youtube.com (**.**.**.**), 30 hops max, 60 byte packets
 1  _gateway (192.168.0.1)  0.342 ms  0.509 ms  0.690 ms
 2 *ISP ipv4*  5.492 ms  5.548 ms  5.616 ms
 3  K12-CORE (**.**.**.**)  5.691 ms  5.769 ms  5.835 ms
 4  FILTER-TSPU-ID-**** (**.**.**.**)  5.926 ms  6.087 ms  5.992 ms
 5  SEL-MX10k3 (**.**.**.**)  6.156 ms  6.216 ms  6.284 ms
...
24  * * *
25  er-in-f198.1e100.net (**.**.**.**)  33.719 ms  33.386 ms *

```
Здесь 192.168.0.1 - основной роутер, ip openwrt роутера в помине нет. Если проблема с этим, то я буду там разбираться. Спасибо заранее.

**Comment by Waujito** [comment]
А, у вас два роутера? Тогда конечно в этом дело

**Comment by suffermuffin** [comment]
Понял, буду искать способы создать подсеть на втором роутере. Спасибо.
