### ISSUE TITLE
Апгрейд ТСПУ 27.12

### ISSUE THREAD

**Issue by Goblin-Mini** [Waujito/youtubeUnblock#335]
Есть у кого рабочая стратегия ,для ростелеком?

UPDATE BY @Waujito 

Да, вижу проблему. Попробуйте поставить флаг `--fake-sni=0`. Проверяйте только с ним, всё остальное пусть будет дефолтное. Даже на роутерах с UI интерфейсом, лучше через сырые флаги его передайте и всё. Убедитесь, что нет строчки `--fake-sni=1` в выводе анблока.

**Comment by Waujito** [comment]
Да, вижу проблему. Попробуйте поставить флаг `--fake-sni=0`.

**Comment by Goblin-Mini** [comment]
> Да, вижу проблему. Попробуйте поставить флаг `--fake-sni=0`.

На каких то роликах работает на каких то глухо

**Comment by Waujito** [comment]
> На каких то роликах работает на каких то глухо

Браузер перезапускали? С другого устройства попробуйте. (на всякий случай) Quic отключен?

**Comment by Konjkov** [comment]
> > На каких то роликах работает на каких то глухо
> 
> Браузер перезапускали? С другого устройства попробуйте. (на всякий случай) Quic отключен?

включен и --udp-filter-quic=all - толку ноль

**Comment by Waujito** [comment]
> включен и --udp-filter-quic=all - толку ноль

Оно может нестабильно работать. Лучше вообще рубануть и запустить анблок только с одним флагом, чтобы базово проверить.

**Comment by okanatov** [comment]
Здравствуйте,

Сегодня утром на телевизоре samsung (tizen os) перестал запускаться youtube. После заставки, чёрный экран и ошибка сети.
Помогла такая конфигурация:

<img width="959" height="830" alt="Image" src="https://github.com/user-attachments/assets/46067500-d1ec-46e1-be9e-a685f8e5c75d" />

youtubeUnblock 1.1.0-1

**Comment by bucefal82** [comment]
> Здравствуйте,
> 
> Сегодня утром на телевизоре samsung (tizen os) перестал запускаться youtube. После заставки, чёрный экран и ошибка сети. Помогла такая конфигурация:
> 
> <img alt="Image" width="959" height="830" src="https://private-user-images.githubusercontent.com/687693/530484171-46067500-d1ec-46e1-be9e-a685f8e5c75d.png?jwt=eyJ0eXAiOiJKV1QiLCJhbGciOiJIUzI1NiJ9.eyJpc3MiOiJnaXRodWIuY29tIiwiYXVkIjoicmF3LmdpdGh1YnVzZXJjb250ZW50LmNvbSIsImtleSI6ImtleTUiLCJleHAiOjE3NjY4NDgwMDQsIm5iZiI6MTc2Njg0NzcwNCwicGF0aCI6Ii82ODc2OTMvNTMwNDg0MTcxLTQ2MDY3NTAwLWQxZWMtNDZlMS1iZTllLWE2ODVmOGU1Yzc1ZC5wbmc_WC1BbXotQWxnb3JpdGhtPUFXUzQtSE1BQy1TSEEyNTYmWC1BbXotQ3JlZGVudGlhbD1BS0lBVkNPRFlMU0E1M1BRSzRaQSUyRjIwMjUxMjI3JTJGdXMtZWFzdC0xJTJGczMlMkZhd3M0X3JlcXVlc3QmWC1BbXotRGF0ZT0yMDI1MTIyN1QxNTAxNDRaJlgtQW16LUV4cGlyZXM9MzAwJlgtQW16LVNpZ25hdHVyZT1jYTdiNDIyZDgzZGQ0OGE4MDc0MjM0MzBkMTFlZDY5ZDlmZWViMDY0Njc1NWIxOGJkMDcxYWJmZDBiMTg0MzViJlgtQW16LVNpZ25lZEhlYWRlcnM9aG9zdCJ9.G82ooCaWopfKBJBc_YtIcGK4jx_hRRBjNp5rjAlHb7o">
> youtubeUnblock 1.1.0-1

Я стакой конфигурации именно сегодня и ушел, не работает.

**Comment by okanatov** [comment]
Эх.. извините, не всё, вероятно, написал. Вся конфигурация такая (скопировал из строки запуска):

Running with flags: --queue-num=537 --threads=1 --packet-mark=32768 --silent --tls=enabled --frag=none --frag-sni-reverse=0 --frag-sni-faked=0 --frag-middle-sni=0 --frag-sni-pos=1 --fk-winsize=0 --fake-sni=1 --fake-sni-seq-len=5 --fake-sni-type=random --faking-strategy=tcp_check --seg2delay=5 --sni-domains=all --sni-detection=parse --synfake=0 --quic-drop --udp-filter-quic=all --udp-mode=drop

**Comment by hukarere** [comment]
У меня в полночь тоже перестал работать 'youtubeUnblock --sni-domains=all', причем перестали работать не только youtube и заблокированные сайты, а вообще любые по https. 
Помогло '--fake-sni-type=random --faking-strategy=tcp_check', которое советовали при предыдущем апргейде ТСПУ в https://github.com/Waujito/youtubeUnblock/issues/312.

**Comment by antiuser** [comment]
ничего не меняйте - в сыром виде у вас должен быть запущен только youtubeUnblock c опцией
`--fake-sni=0 `
подтверждаю, работает, с Наступающим Новым Годом!

**Comment by hukarere** [comment]
> У меня в полночь тоже перестал работать 'youtubeUnblock --sni-domains=all', причем перестали работать не только youtube и заблокированные сайты, а вообще любые по https. Помогло '--fake-sni-type=random --faking-strategy=tcp_check', которое советовали при предыдущем апргейде ТСПУ в [#312](https://github.com/Waujito/youtubeUnblock/issues/312).

С '--fake-sni=0' без остального тоже работает.

**Comment by Konjkov** [comment]
> > У меня в полночь тоже перестал работать 'youtubeUnblock --sni-domains=all', причем перестали работать не только youtube и заблокированные сайты, а вообще любые по https. Помогло '--fake-sni-type=random --faking-strategy=tcp_check', которое советовали при предыдущем апргейде ТСПУ в [#312](https://github.com/Waujito/youtubeUnblock/issues/312).
> 
> С '--fake-sni=0' без остального тоже работает.

скинь вывод команд
dig +short www.youtube.com
youtube-ui.l.google.com.
216.58.210.174

и

mtr -rw 216.58.210.174
Start: 2025-12-27T23:01:30+0700
HOST: vladimir-Kubuntu              Loss%   Snt   Last   Avg  Best  Wrst StDev
  1.|-- _gateway                       0.0%    10    0.3   0.3   0.2   0.4   0.1
  2.|-- 192.168.0.1                    0.0%    10    0.8   0.6   0.4   0.8   0.1
  3.|-- <мой провайдер>  0.0%    10    1.5   1.5   1.4   1.6   0.1
  4.|-- 10.245.139.121                 0.0%    10    1.5   2.1   1.4   7.6   1.9
  5.|-- 10.245.139.30                  0.0%    10    2.2   1.9   1.6   3.1   0.5
  6.|-- <мой провайдер>       0.0%    10    1.7   1.9   1.7   2.1   0.1
  7.|-- bbr03.spb.ertelecom.ru         0.0%    10   40.8  41.0  40.8  41.5   0.2
  8.|-- 72.14.214.138                  0.0%    10   42.8  42.9  42.7  43.0   0.1
  9.|-- 172.253.76.91                  0.0%    10   42.8  42.9  42.7  43.0   0.1
 10.|-- 74.125.244.180                 0.0%    10   43.0  43.5  42.9  44.3   0.5
 11.|-- 142.251.61.219                 0.0%    10   60.9  62.2  60.6  70.9   3.2
 12.|-- 142.251.237.147               90.0%    10   46.8  46.8  46.8  46.8   0.0
 13.|-- 142.251.237.140                0.0%    10   58.9  71.3  58.8 152.4  28.9
 14.|-- 192.178.104.229                0.0%    10   59.3  59.3  59.2  59.5   0.1
 15.|-- 142.250.227.85                 0.0%    10   54.9  55.2  54.8  56.3   0.5
 16.|-- bud02s21-in-f174.1e100.net     0.0%    10   57.1  57.1  56.9  57.2   0.1

У меня валятся  90% пакетов на хопе 142.251.237.147, по итогу (ошибка)net::ERR_TIMED_OUT, а 216.58.210.174 не самый близкий CDN, тем не менее мой провайдер именно туда посылает!

**Comment by kublo71** [comment]
РНД, провайдер ТТК, для телеков Samsung помогла такая конфигурация
<img width="555" height="838" alt="Image" src="https://github.com/user-attachments/assets/85fda2dd-fb69-41ee-9bdf-3f6b0f90448d" />

**Comment by Yusupoff** [comment]
Провайдер 1:
```sh
dig +short www.youtube.com
youtube-ui.l.google.com.
wide-youtube.l.google.com.
173.194.220.198
```
```sh
Start: 2025-12-27T23:48:36+0300
HOST: RouteRich                  Loss%   Snt   Last   Avg  Best  Wrst StDev
  1.|-- 10.105.0.1                  0.0%    10    8.6  11.5   2.1  28.5   9.4
  2.|-- 172.31.1.1                  0.0%    10    0.8   1.0   0.8   1.2   0.1
  3.|-- vgd06rb.transtelecom.net    0.0%    10    2.5   2.5   2.2   3.7   0.5
  4.|-- BL-gw.transtelecom.net      0.0%    10  114.9 115.2 114.9 115.6   0.2
  5.|-- BL-gw.transtelecom.net      0.0%    10  113.8 113.6 113.3 113.8   0.2
  6.|-- BL-gw.transtelecom.net      0.0%    10  113.7 114.1 113.6 116.9   1.0
  7.|-- mskn19ra.transtelecom.net   0.0%    10  121.5 122.2 120.8 127.5   2.0
  8.|-- Google-gw.transtelecom.net  0.0%    10  120.0 122.2 119.7 130.5   3.6
  9.|-- 172.253.75.73              20.0%    10  128.7 128.2 127.8 128.7   0.3
 10.|-- 209.85.143.20               0.0%    10  122.1 122.4 122.1 122.9   0.2
 11.|-- 142.251.238.82             50.0%    10  143.7 143.4 143.0 143.7   0.3
 12.|-- 142.251.238.66              0.0%    10  143.4 149.4 143.2 189.9  14.4
 13.|-- 172.253.51.221              0.0%    10  143.8 143.9 143.6 144.4   0.3
 14.|-- ???                        100.0    10    0.0   0.0   0.0   0.0   0.0
 15.|-- ???                        100.0    10    0.0   0.0   0.0   0.0   0.0
 16.|-- ???                        100.0    10    0.0   0.0   0.0   0.0   0.0
 17.|-- ???                        100.0    10    0.0   0.0   0.0   0.0   0.0
 18.|-- ???                        100.0    10    0.0   0.0   0.0   0.0   0.0
 19.|-- ???                        100.0    10    0.0   0.0   0.0   0.0   0.0
 20.|-- ???                        100.0    10    0.0   0.0   0.0   0.0   0.0
 21.|-- ???                        100.0    10    0.0   0.0   0.0   0.0   0.0
 22.|-- ???                        100.0    10    0.0   0.0   0.0   0.0   0.0
 23.|-- lk-in-f198.1e100.net        0.0%    10  142.9 143.0 142.7 143.6   0.2
```
Провайдер 2:
```sh
dig +short www.youtube.com
youtube-ui.l.google.com.
wide-youtube.l.google.com.
64.233.165.198
```
```sh
Start: 2025-12-27T23:36:07+0300
HOST: Cudy                 Loss%   Snt   Last   Avg  Best  Wrst StDev
  1.|-- 192.168.1.1           0.0%    10    0.5   1.1   0.5   2.2   0.6
  2.|-- 10.10.10.10           0.0%    10    3.0   2.3   1.7   3.4   0.6
  3.|-- 192.168.83.5          0.0%    10    2.7   2.6   2.4   2.8   0.2
  4.|-- 10.5.57.254           0.0%    10    3.1   5.3   2.5  17.9   4.6
  5.|-- 178.176.146.105       0.0%    10   18.9  19.0  18.6  19.7   0.3
  6.|-- ???                  100.0    10    0.0   0.0   0.0   0.0   0.0
  7.|-- ???                  100.0    10    0.0   0.0   0.0   0.0   0.0
  8.|-- ???                  100.0    10    0.0   0.0   0.0   0.0   0.0
  9.|-- 83.169.204.119        0.0%    10   32.7  32.3  31.9  32.7   0.3
 10.|-- 72.14.222.181         0.0%    10   55.9  60.4  55.9  85.1   9.0
 11.|-- 192.178.241.51        0.0%    10   57.1  57.3  57.0  57.9   0.3
 12.|-- 192.178.241.66       50.0%    10   56.3  56.4  56.2  56.6   0.2
 13.|-- 209.85.249.158       70.0%    10   69.8  63.8  60.7  69.8   5.2
 14.|-- 216.239.43.20         0.0%    10   59.8  60.7  59.4  68.3   2.7
 15.|-- 216.239.63.25         0.0%    10   60.3  60.6  60.2  61.9   0.5
 16.|-- ???                  100.0    10    0.0   0.0   0.0   0.0   0.0
 17.|-- ???                  100.0    10    0.0   0.0   0.0   0.0   0.0
 18.|-- ???                  100.0    10    0.0   0.0   0.0   0.0   0.0
 19.|-- ???                  100.0    10    0.0   0.0   0.0   0.0   0.0
 20.|-- ???                  100.0    10    0.0   0.0   0.0   0.0   0.0
 21.|-- ???                  100.0    10    0.0   0.0   0.0   0.0   0.0
 22.|-- lg-in-f198.1e100.net  0.0%    10   63.3  61.2  60.7  63.3   0.8
```

**Comment by Waujito** [comment]
Я не думаю что ваши трейсроуты хоть как то могут помочь, не надо спамить ими и сливать айпишники)

**Comment by kostet1010** [comment]
> Эх.. извините, не всё, вероятно, написал. Вся конфигурация такая (скопировал из строки запуска):
> 
> Running with flags: --queue-num=537 --threads=1 --packet-mark=32768 --silent --tls=enabled --frag=none --frag-sni-reverse=0 --frag-sni-faked=0 --frag-middle-sni=0 --frag-sni-pos=1 --fk-winsize=0 --fake-sni=1 --fake-sni-seq-len=5 --fake-sni-type=random --faking-strategy=tcp_check --seg2delay=5 --sni-domains=all --sni-detection=parse --synfake=0 --quic-drop --udp-filter-quic=all --udp-mode=drop

Помогло ростелеком

**Comment by Konjkov** [comment]
> > Эх.. извините, не всё, вероятно, написал. Вся конфигурация такая (скопировал из строки запуска):
> > Running with flags: --queue-num=537 --threads=1 --packet-mark=32768 --silent --tls=enabled --frag=none --frag-sni-reverse=0 --frag-sni-faked=0 --frag-middle-sni=0 --frag-sni-pos=1 --fk-winsize=0 --fake-sni=1 --fake-sni-seq-len=5 --fake-sni-type=random --faking-strategy=tcp_check --seg2delay=5 --sni-domains=all --sni-detection=parse --synfake=0 --quic-drop --udp-filter-quic=all --udp-mode=drop
> 
> Помогло ростелеком

Интересно чем помог флаг --silent в этой конфигурации?

**Comment by Kudrikudrii** [comment]
> Здравствуйте,
> 
> Сегодня утром на телевизоре samsung (tizen os) перестал запускаться youtube. После заставки, чёрный экран и ошибка сети. Помогла такая конфигурация:
> 
> <img alt="Image" width="959" height="830" src="https://private-user-images.githubusercontent.com/687693/530484171-46067500-d1ec-46e1-be9e-a685f8e5c75d.png?jwt=eyJ0eXAiOiJKV1QiLCJhbGciOiJIUzI1NiJ9.eyJpc3MiOiJnaXRodWIuY29tIiwiYXVkIjoicmF3LmdpdGh1YnVzZXJjb250ZW50LmNvbSIsImtleSI6ImtleTUiLCJleHAiOjE3NjY5NDcxMzQsIm5iZiI6MTc2Njk0NjgzNCwicGF0aCI6Ii82ODc2OTMvNTMwNDg0MTcxLTQ2MDY3NTAwLWQxZWMtNDZlMS1iZTllLWE2ODVmOGU1Yzc1ZC5wbmc_WC1BbXotQWxnb3JpdGhtPUFXUzQtSE1BQy1TSEEyNTYmWC1BbXotQ3JlZGVudGlhbD1BS0lBVkNPRFlMU0E1M1BRSzRaQSUyRjIwMjUxMjI4JTJGdXMtZWFzdC0xJTJGczMlMkZhd3M0X3JlcXVlc3QmWC1BbXotRGF0ZT0yMDI1MTIyOFQxODMzNTRaJlgtQW16LUV4cGlyZXM9MzAwJlgtQW16LVNpZ25hdHVyZT00MjA2NjJlMmExMGM3ODA5NDgwZGY0MTE5MjE4MjdhNWIzZjQ1NDI2ODkzNDA4ZmZkMmVhOTA4NzEyYThmYTgwJlgtQW16LVNpZ25lZEhlYWRlcnM9aG9zdCJ9.OOzD44tHA0PM2GSRDCm4mozM8Tbl9Qn-SeBg68Al2Xs">
> youtubeUnblock 1.1.0-1

для меня оказался рабочий конфиг
заработало на телевизоре LG(WebOS) и на iOS устройствах
QUIC drop включен
интернет Мегафон МСК

**Comment by asolocloud** [comment]
--fake-sni=0 работает только в браузерах.

**Comment by glebbuk** [comment]
> Здравствуйте,
> 
> Сегодня утром на телевизоре samsung (tizen os) перестал запускаться youtube. После заставки, чёрный экран и ошибка сети. Помогла такая конфигурация:
> 
> <img alt="Image" width="959" height="830" src="https://private-user-images.githubusercontent.com/687693/530484171-46067500-d1ec-46e1-be9e-a685f8e5c75d.png?jwt=eyJ0eXAiOiJKV1QiLCJhbGciOiJIUzI1NiJ9.eyJpc3MiOiJnaXRodWIuY29tIiwiYXVkIjoicmF3LmdpdGh1YnVzZXJjb250ZW50LmNvbSIsImtleSI6ImtleTUiLCJleHAiOjE3NjcwMzE0OTMsIm5iZiI6MTc2NzAzMTE5MywicGF0aCI6Ii82ODc2OTMvNTMwNDg0MTcxLTQ2MDY3NTAwLWQxZWMtNDZlMS1iZTllLWE2ODVmOGU1Yzc1ZC5wbmc_WC1BbXotQWxnb3JpdGhtPUFXUzQtSE1BQy1TSEEyNTYmWC1BbXotQ3JlZGVudGlhbD1BS0lBVkNPRFlMU0E1M1BRSzRaQSUyRjIwMjUxMjI5JTJGdXMtZWFzdC0xJTJGczMlMkZhd3M0X3JlcXVlc3QmWC1BbXotRGF0ZT0yMDI1MTIyOVQxNzU5NTNaJlgtQW16LUV4cGlyZXM9MzAwJlgtQW16LVNpZ25hdHVyZT1mODEzODc5OGMzZjQ3N2IxNWVjN2FiZDAzN2JjZTRkZGY1OWYyMTk0MmY2NThjYjkyMzIyZmI4ZjVlNDJhYzZiJlgtQW16LVNpZ25lZEhlYWRlcnM9aG9zdCJ9.WYZcJAxlN9k5Z37i0incXaDKSgOL_ssSzEqAVWCcATg">
> youtubeUnblock 1.1.0-1

спасибо, помогло на webos

**Comment by ALexeyAL1** [comment]
На телевизоре работает, на компьютере через раз, на телефоне первый ролик запускаю на байбайдпи потом может и само работать. Как соотносить флаги запрета и байбая с настройками программы? Могу я сделать подбор стратегий, а потом вручную выставить нужные значения? Мануал читал давно, но так и не понял, как просто передать аргументы командной строки анблоку? Сеть ли в планах сделать поле в гуе опенврт для добавления аргументов командной строки. Наверное непонятно написал.
Пример. Я нахожу аргументы строки тут, но не знаю куда их писать.Через путти когда-то получалось, но можно сделать отдельную вкладку в гуе опенврт, например /cgi-bin/luci/admin/services/youtubeUnblock/command
В которой все эти галочки будут в виде команды, чтобы найдя стратегию на форуме, Я мог просто вставить её сюда, нажать применить и проверить. Моих знаний увы не хватает.

И ещё вопрос вот через байбай я провел проверку сети, вот выдало аргументы, но какие буквы тут каким аргументам анблоку соответствуют, Я не знаю. Можно микро мануал сделать. Если в байбай -б то ставим --факркн и т.п.
![Image](https://github.com/user-attachments/assets/b3e60c74-5273-42b7-8652-01765672aefe)

**Comment by okanatov** [comment]
> > > Эх.. извините, не всё, вероятно, написал. Вся конфигурация такая (скопировал из строки запуска):
> > > Running with flags: --queue-num=537 --threads=1 --packet-mark=32768 --silent --tls=enabled --frag=none --frag-sni-reverse=0 --frag-sni-faked=0 --frag-middle-sni=0 --frag-sni-pos=1 --fk-winsize=0 --fake-sni=1 --fake-sni-seq-len=5 --fake-sni-type=random --faking-strategy=tcp_check --seg2delay=5 --sni-domains=all --sni-detection=parse --synfake=0 --quic-drop --udp-filter-quic=all --udp-mode=drop
> > 
> > 
> > Помогло ростелеком
> 
> Интересно чем помог флаг --silent в этой конфигурации?

Ну, очевидно, ничем. Он же только понижает уровень логирования в программе.
Мне больше не нравится здесь --sni-domains=all. Судя по всему, настройки (ну и собственно работа программы) применяется ко всем адресам/доменным именам. Некоторые у меня перестали открываться. Пока добавляю такие в список Excluded.
Буду благодарен если кто-то напишет конфигурацию без "=all". Может какой-то новый домен для youtube'а надо добавить, чтобы работало на прежних настройках? (до того как перестало работать у меня все домены дефолтные стояли в настройках).

**Comment by alex9374** [comment]
> Эх.. извините, не всё, вероятно, написал. Вся конструкция такая (скопировала из строки запуска):
> 
> Запуск с флагами: --queue-num=537 --threads=1 --packet-mark=32768 --silent --tls=enabled --frag=none --frag-sni-reverse=0 --frag-sni-faked=0 --frag-middle-sni=0 --frag-sni-pos=1 --fk-winsize=0 --fake-sni=1 --fake-sni-seq-len=5 --fake-sni-type=random --faking-strategy=tcp_check --seg2delay=5 --sni-domains=all --sni-detection=parse --synfake=0 --quic-drop --udp-filter-quic=all --udp-mode=drop

А куда это вставлять, сюда? :

![Image](https://github.com/user-attachments/assets/c54a9941-6d33-443a-9e6b-78a64a022178)

Если сюда, то вообще ничего не работает из того что описано в данной теме.

**Comment by DenStealer** [comment]
> > Эх.. извините, не всё, вероятно, написал. Вся конструкция такая (скопировала из строки запуска):
> > Запуск с флагами: --queue-num=537 --threads=1 --packet-mark=32768 --silent --tls=enabled --frag=none --frag-sni-reverse=0 --frag-sni-faked=0 --frag-middle-sni=0 --frag-sni-pos=1 --fk-winsize=0 --fake-sni=1 --fake-sni-seq-len=5 --fake-sni-type=random --faking-strategy=tcp_check --seg2delay=5 --sni-domains=all --sni-detection=parse --synfake=0 --quic-drop --udp-filter-quic=all --udp-mode=drop
> 
> А куда это вставлять, сюда? :
> 
> ![Image](https://github.com/user-attachments/assets/c54a9941-6d33-443a-9e6b-78a64a022178)
> 
> Если сюда, то вообще ничего не работает из того что описано в данной теме.

Нет, это конечный результат всех поставленных галочек в текстовом виде, если по порядку пройдитесь, то все поймёте

**Comment by bob-cattle** [comment]
Я правильно понимаю что на текущий момент нет никакого рабочего решения и YouTubeunblock поломан? Не работает на lg и на телефоне(только через веб-версию)

**Comment by FoxExe** [comment]
Я поменял "Faking strategy" на "randseq" и "Fake sni type" тоже на "random" и всё снова стало работать как надо.
Пробуйте, может тоже кому поможет.

![Image](https://github.com/user-attachments/assets/5e7fed0b-0741-4738-afaf-cc65c7c41e9e)

**Comment by yudai-patronai** [comment]
На 18 января ни один из вышеописанных вариантов не работает. Провайдер покупает инет у Ростелекома - обычно все как в Ростелекоме.

**Comment by yudai-patronai** [comment]
Как будто вот этот вариант 
https://github.com/Waujito/youtubeUnblock/issues/312#issuecomment-3638488141
сработал. Даже без --fake-sni=0

**Comment by yudai-patronai** [comment]
По состоянию на вечер 18 января все снова повисло. https://github.com/Waujito/youtubeUnblock/issues/312#issuecomment-3638488141 уже не срабатывает, и с --fake-sni=0 тоже

**Comment by yudai-patronai** [comment]
По состоянию на вечер 18 января все снова повисло. https://github.com/Waujito/youtubeUnblock/issues/312#issuecomment-3638488141 уже не срабатывает, и с --fake-sni=0 тоже

**Comment by Auditlt** [comment]
До сих пор работает на таких настройках https://github.com/Waujito/youtubeUnblock/issues/312#issuecomment-3616251902. youtubeUnblock 1.0.0-10

**Comment by manchelsi** [comment]
RKN is dropping packets somewhere in the middle of a session. Here, packet 54 isn't receiving any responses from the server:

``` 10 27.568303390 10.236.102.147 → 10.236.102.1 DNS 86 Standard query 0x1cad AAAA www.svoboda.org OPT                                                                                           13:55:32 [0/4790]
   11 27.711566849 10.236.102.1 → 10.236.102.147 DNS 217 Standard query response 0xd409 A www.svoboda.org CNAME rfe-prod-1.cert.pangeadigital.io.edgekey.net CNAME e110624.dsca.akamaiedge.net A 95.101.116.28 A 9
5.101.116.4 OPT                                                                                                                                                                                                   
   12 27.712129438 10.236.102.1 → 10.236.102.147 DNS 241 Standard query response 0x1cad AAAA www.svoboda.org CNAME rfe-prod-1.cert.pangeadigital.io.edgekey.net CNAME e110624.dsca.akamaiedge.net AAAA 2a02:26f0:3
780:1a::5f65:7404 AAAA 2a02:26f0:3780:1a::5f65:741c OPT                                                                                                                                                           
   13 27.712526404 10.236.102.147 → 95.101.116.28 TCP 74 38730 → 443 [SYN] Seq=0 Win=64240 Len=0 MSS=1460 SACK_PERM TSval=3314173976 TSecr=0 WS=128                                       
   14 27.774758651 95.101.116.28 → 10.236.102.147 TCP 74 443 → 38730 [SYN, ACK] Seq=0 Ack=1 Win=65160 Len=0 MSS=1384 SACK_PERM TSval=2202652738 TSecr=3314173976 WS=128
   15 27.774783717 10.236.102.147 → 95.101.116.28 TCP 66 38730 → 443 [ACK] Seq=1 Ack=1 Win=64256 Len=0 TSval=3314174039 TSecr=2202652738                                             
   16 27.776526513 10.236.102.147 → 95.101.116.28 TLSv1 583 Client Hello                                                                                                                                          
   17 27.838792323 95.101.116.28 → 10.236.102.147 TCP 78 [TCP Window Update] 443 → 38730 [ACK] Seq=1 Ack=1 Win=65280 Len=0 TSval=2202652802 TSecr=3314174039 SLE=161 SRE=518
   18 27.838795247 95.101.116.28 → 10.236.102.147 TCP 78 [TCP Dup ACK 14#1] 443 → 38730 [ACK] Seq=1 Ack=1 Win=65280 Len=0 TSval=2202652802 TSecr=3314174039 SLE=2 SRE=518            
   19 27.839245143 95.101.116.28 → 10.236.102.147 TCP 66 443 → 38730 [ACK] Seq=1 Ack=518 Win=64768 Len=0 TSval=2202652802 TSecr=3314174040                                                 
   20 27.841077071 95.101.116.28 → 10.236.102.147 TLSv1.3 1494 Server Hello, Change Cipher Spec, Application Data                                                                                                 
   21 27.841088631 10.236.102.147 → 95.101.116.28 TCP 66 38730 → 443 [ACK] Seq=518 Ack=1429 Win=62848 Len=0 TSval=3314174105 TSecr=2202652804                                         
   22 27.841293562 95.101.116.28 → 10.236.102.147 TLSv1.3 1494 Application Data                                                                                                                                   
   23 27.841304466 10.236.102.147 → 95.101.116.28 TCP 66 38730 → 443 [ACK] Seq=518 Ack=2857 Win=61440 Len=0 TSval=3314174105 TSecr=2202652804 
   24 27.841296734 95.101.116.28 → 10.236.102.147 TLSv1.3 388 Application Data, Application Data                                                                                                                  
   25 27.841308044 10.236.102.147 → 95.101.116.28 TCP 66 38730 → 443 [ACK] Seq=518 Ack=3179 Win=61184 Len=0 TSval=3314174105 TSecr=2202652804                                              
   26 27.842635497 10.236.102.147 → 95.101.116.28 TLSv1.3 146 Change Cipher Spec, Application Data                                                                                                                
   27 27.842809628 10.236.102.147 → 95.101.116.28 TLSv1.3 152 Application Data                                                                                                                                    
   28 27.842900683 10.236.102.147 → 95.101.116.28 TLSv1.3 129 Application Data                                                                                                                                    
   29 27.904764315 95.101.116.28 → 10.236.102.147 TCP 66 443 → 38730 [ACK] Seq=3179 Ack=598 Win=64768 Len=0 TSval=2202652868 TSecr=3314174107                            
   30 27.904767713 95.101.116.28 → 10.236.102.147 TLSv1.3 369 Application Data                                                                                                                                    
   31 27.904890085 95.101.116.28 → 10.236.102.147 TLSv1.3 369 Application Data                                                                                                                                    
   32 27.905003936 10.236.102.147 → 95.101.116.28 TCP 66 38730 → 443 [ACK] Seq=747 Ack=3785 Win=60672 Len=0 TSval=3314174169 TSecr=2202652868                                                                     
   33 27.905152245 95.101.116.28 → 10.236.102.147 TCP 66 443 → 38730 [ACK] Seq=3785 Ack=747 Win=64640 Len=0 TSval=2202652868 TSecr=3314174107                                                                     
   34 27.912323414 95.101.116.28 → 10.236.102.147 TLSv1.3 127 Application Data                                                                                                                                    
   35 27.912376830 10.236.102.147 → 95.101.116.28 TLSv1.3 97 Application Data                                                                                                                                     
   36 27.912567758 95.101.116.28 → 10.236.102.147 TLSv1.3 97 Application Data                                                                                                                                     
   37 27.913085527 95.101.116.28 → 10.236.102.147 TLSv1.3 348 Application Data                                                                                                                                    
   38 27.913172080 10.236.102.147 → 95.101.116.28 TCP 66 38730 → 443 [ACK] Seq=778 Ack=4159 Win=60416 Len=0 TSval=3314174177 TSecr=2202652876
   39 27.913557132 95.101.116.28 → 10.236.102.147 TCP 1494 [TCP segment of a reassembled PDU]                                                                                                                     
   40 27.913796606 95.101.116.28 → 10.236.102.147 TCP 1494 443 → 38730 [PSH, ACK] Seq=5587 Ack=747 Win=64640 Len=1428 TSval=2202652877 TSecr=3314174107 [TCP segment of a reassembled PDU]
   41 27.913803213 10.236.102.147 → 95.101.116.28 TCP 66 38730 → 443 [ACK] Seq=778 Ack=7015 Win=57600 Len=0 TSval=3314174178 TSecr=2202652877
   42 27.913798861 95.101.116.28 → 10.236.102.147 TCP 1494 443 → 38730 [ACK] Seq=7015 Ack=747 Win=64640 Len=1428 TSval=2202652877 TSecr=3314174107 [TCP segment of a reassembled PDU]
   43 27.914044652 95.101.116.28 → 10.236.102.147 TCP 1494 443 → 38730 [PSH, ACK] Seq=8443 Ack=747 Win=64640 Len=1428 TSval=2202652877 TSecr=3314174107 [TCP segment of a reassembled PDU]
   44 27.914050822 10.236.102.147 → 95.101.116.28 TCP 66 38730 → 443 [ACK] Seq=778 Ack=9871 Win=54784 Len=0 TSval=3314174178 TSecr=2202652877
   45 27.914047112 95.101.116.28 → 10.236.102.147 TCP 1494 443 → 38730 [ACK] Seq=9871 Ack=747 Win=64640 Len=1428 TSval=2202652877 TSecr=3314174107 [TCP segment of a reassembled PDU]
   46 27.914288015 95.101.116.28 → 10.236.102.147 TCP 1494 443 → 38730 [PSH, ACK] Seq=11299 Ack=747 Win=64640 Len=1428 TSval=2202652877 TSecr=3314174107 [TCP segment of a reassembled PDU]
   47 27.914294364 10.236.102.147 → 95.101.116.28 TCP 66 38730 → 443 [ACK] Seq=778 Ack=12727 Win=54400 Len=0 TSval=3314174178 TSecr=2202652877
   48 27.914290572 95.101.116.28 → 10.236.102.147 TCP 1494 443 → 38730 [ACK] Seq=12727 Ack=747 Win=64640 Len=1428 TSval=2202652877 TSecr=3314174107 [TCP segment of a reassembled PDU]
   49 27.914532887 95.101.116.28 → 10.236.102.147 TCP 1494 443 → 38730 [PSH, ACK] Seq=14155 Ack=747 Win=64640 Len=1428 TSval=2202652877 TSecr=3314174107 [TCP segment of a reassembled PDU]
   50 27.914536103 10.236.102.147 → 95.101.116.28 TCP 66 38730 → 443 [ACK] Seq=778 Ack=15583 Win=54400 Len=0 TSval=3314174178 TSecr=2202652877
   51 27.917124528 95.101.116.28 → 10.236.102.147 TCP 1494 443 → 38730 [ACK] Seq=15583 Ack=747 Win=64640 Len=1428 TSval=2202652880 TSecr=3314174107 [TCP segment of a reassembled PDU]
   52 27.917336396 95.101.116.28 → 10.236.102.147 TCP 1494 443 → 38730 [PSH, ACK] Seq=17011 Ack=747 Win=64640 Len=1428 TSval=2202652880 TSecr=3314174107 [TCP segment of a reassembled PDU]
   53 27.917339818 10.236.102.147 → 95.101.116.28 TCP 66 38730 → 443 [ACK] Seq=778 Ack=18439 Win=54400 Len=0 TSval=3314174181 TSecr=2202652880
   54 28.192725368 10.236.102.147 → 95.101.116.28 TCP 97 [TCP Retransmission] 38730 → 443 [PSH, ACK] Seq=747 Ack=18439 Win=55808 Len=31 TSval=3314174457 TSecr=2202652880
   55 28.480767694 10.236.102.147 → 95.101.116.28 TCP 97 [TCP Retransmission] 38730 → 443 [PSH, ACK] Seq=747 Ack=18439 Win=55808 Len=31 TSval=3314174745 TSecr=2202652880
   56 29.024723801 10.236.102.147 → 95.101.116.28 TCP 97 [TCP Retransmission] 38730 → 443 [PSH, ACK] Seq=747 Ack=18439 Win=55808 Len=31 TSval=3314175289 TSecr=2202652880
   57 30.112771995 10.236.102.147 → 95.101.116.28 TCP 97 [TCP Retransmission] 38730 → 443 [PSH, ACK] Seq=747 Ack=18439 Win=55808 Len=31 TSval=3314176377 TSecr=2202652880
   58 32.416730958 10.236.102.147 → 95.101.116.28 TCP 97 [TCP Retransmission] 38730 → 443 [PSH, ACK] Seq=747 Ack=18439 Win=55808 Len=31 TSval=3314178681 TSecr=2202652880
   59 32.928585308 10:66:6a:46:53:4f → 10:66:6a:be:fa:73 ARP 42 Who has 10.236.102.147? Tell 10.236.102.1                                                                                                         
   60 32.928638411 10:66:6a:be:fa:73 → 10:66:6a:46:53:4f ARP 42 10.236.102.147 is at 10:66:6a:be:fa:73                                                                                                            
   61 36.768675889 10.236.102.147 → 95.101.116.28 TCP 97 [TCP Retransmission] 38730 → 443 [PSH, ACK] Seq=747 Ack=18439 Win=55808 Len=31 TSval=3314183033 TSecr=2202652880```

**Comment by manchelsi** [comment]
Maybe they are using a certificate to find out the domain somehow? I assume that YouTube is allowed, since its certificate is *.google.com and is valid for many other domains.

**Comment by asolocloud** [comment]
Сегодня работает только в браузерах, smarttube пару дней назад еще работал, картинки кажет, видео нет, 1.1.1-1 debian-ubuntu, флаги все перепробовал, ноль.

**Comment by Waujito** [comment]
Дальнейшее обсуждение в #356
